pageid,ns,title,extract
287183,0,Chhatrapati Shivaji Maharaj International Airport,"Chhatrapati Shivaji Maharaj International Airport (छत्रपती शिवाजी महाराज आंतरराष्ट्रीय विमानतळ) (IATA: BOM, ICAO: VABB) is the primary international airport serving Mumbai, Maharashtra, India. It is the second busiest airport in the country in terms of total and international passenger traffic after Delhi, and was the 14th busiest airport in Asia and 41st busiest airport in the world by passenger traffic in calendar year 2019. Its passenger traffic was about 49.8 million in year 2018. It is also the second busiest airport in terms of cargo traffic. In March 2017, the airport surpassed London's Gatwick Airport as the world's busiest to operate a single runway at a time. This was later surpassed again by Gatwick Airport at the end of 2019 due to passenger numbers falling at Mumbai. The airport's IATA code BOM is associated with ""Bombay"", the city's former legal name.
The airport has two operating terminals spread over a total land area of 750 hectares (1,850 acres) and handles about 950 aircraft movements per day. It handled a record 1,007 aircraft movements on 9 December 2018, higher than its earlier record of 1,003 flight movements in a day in June 2018. It handled a record 51 movements in one hour on 16 September 2014. Along with IGI Delhi, it was adjudged the ""World's Best Airport"" at Airport Service Quality Awards 2017 in the highest category of airports handling more than 40 million passengers annually by Airports Council International. It has also won the ""Best Airport in India and Central Asia"" award at the Skytrax 2016 World Airport Awards. It is one of the three airports in India to have implemented Airport Collaborative Decision Making (A-CDM) to ensure timely takeoffs and landings. In financial year 2020, the Mumbai Airport handled 45.87 million passengers, only second to IGI's 67.3 million in India.The airport is operated by Mumbai International Airport Limited (MIAL), a Joint Venture between the Airports Authority of India and the GVK Industries Ltd led consortium which was appointed in February 2006 to carry out the modernisation of the Airport. The new integrated terminal T2 was inaugurated on 10 January 2014 and opened for international operations on 12 February 2014. A dedicated six lane, elevated road connecting the new terminal with the main arterial Western Express Highway was also opened to the public the same day.The airport is named after the 17th-century Maratha king Chhatrapati Shivaji Maharaj, having been renamed in 1999 from the previous ""Sahar Airport"" to ""Chhatrapati Shivaji Maharaj International Airport"" (the title ""Maharaj"" was inserted on 30 August 2018). It is situated across the suburbs of Santacruz and Sahar Village in Vile Parle East. The airport is awarded as the best airport in Asia-Pacific in 2020 (over 40 million passengers per annum) by Airports Council International."
322415,0,Chiang Kai-Shek International Airport,
7313295,0,Chiang Kai-shek International Airport,
266332,0,Chiang Kai Shek International Airport,
13746361,0,Chiang Kai Shiek International Airport,
266300,0,Chiang Mai International Airport,"Chiang Mai International Airport (Thai: ท่าอากาศยานเชียงใหม่) (IATA: CNX, ICAO: VTCC) is an international airport serving Chiang Mai, the capital city of Chiang Mai Province in Thailand.  It is a major gateway to Northern Thailand, and currently the fourth-busiest airport in the country."
266303,0,Chiang Rai International Airport,"Mae Fah Luang - Chiang Rai International Airport (Thai: ท่าอากาศยานแม่ฟ้าหลวง เชียงราย; pronunciation  ) (old name: Chiang Rai International Airport (Thai: ท่าอากาศยานเชียงราย)) (IATA: CEI, ICAO: VTCT) is in the city of Chiang Rai in northern Thailand. The airport is about 8 km from the city center. Since 1998 it has been managed by the Airports of Thailand Public Company Limited (AOT). In 2013 the airport handled over 1,000,000 passengers and 7,000 passenger flights. The airport has international flight facilities and serves few international routes to Kunming, Haikou, Hangzhou, Changsha, Xishuangbanna, Shenzhen, and Chengdu.
In 2014, Airports of Thailand said that they would expand Chiang Rai airport. The plans include building an additional taxiway and more shops, and possibly extending the runway. This should be completed in 2030.Chiang Rai International Airport was named ""Mae Fah Luang"", after Princess Srinagarindra, mother of the previous monarch, Bhumibol Adulyadej, reigning under the dynastic name of Rama IX."
10468803,0,Chicago-Midway International Airport,
7513419,0,Chicago-O'Hare International Airport,
14811530,0,Chicago/Rockford International Airport,
15475401,0,Chicago International Airport,"Chicago International Airport may refer to:

O'Hare International Airport, Chicago's largest airport and largest international gateway
Chicago Midway International Airport, the first airport with that name
Gary Chicago International Airport, an airport in Gary, Indiana
Chicago Rockford International Airport"
44249325,0,Chicago Midway International Airport,
27923009,0,Chicago O'Hare International Airport,
423177,0,Chicago O' Hare International Airport,
27821036,0,Chicago O'hare International Airport,
33968795,0,Chicago O´Hare International Airport,
24396388,0,Chicago O’Hare International Airport,
2514876,0,Chicago Rockford International Airport,"Chicago Rockford International Airport (IATA: RFD, ICAO: KRFD, FAA LID: RFD), is in Winnebago County, Illinois, United States, four miles (6 km) south of Rockford and 85 miles northwest of Chicago.Since 1994 the airport has been a major hub for UPS Airlines, which has two facilities at the airport.  In terms of passenger service, the airport offers year-round direct service to five destinations, along with seasonal destinations. The Federal Aviation Administration (FAA) National Plan of Integrated Airport Systems for 2017–2021 categorized it as a non-hub primary commercial service facility."
39502187,0,Chichen Itza International Airport,"Chichen Itza International Airport (IATA: CZA, ICAO: MMCT) is an international airport located in Chichen Itza, Yucatán, Mexico, in the northern Yucatán Peninsula. Airport construction began in 1999 and it was inaugurated on April 12, 2000 with an investment of 135 million pesos (about US$14,250,000 in that year). Initially, Aeroméxico, Mexicana, Aerocozumel and American Airlines were interested in making operations at the airport, shortly after the airlines stopped operating because it was not profitable, the tourists arrived first to Cancún and after they went to Chichén Itzá in car or bus. Currently the airport is almost inoperative and has left a debt of 27 million pesos (about US$1,450,000)."
4407902,0,Chiclayo International Airport,
2015538,0,Chihuahua International Airport,"General Roberto Fierro Villalobos International Airport (IATA: CUU, ICAO: MMCU) is an international airport located in Chihuahua City, Chihuahua, Mexico. Operated by Grupo Aeroportuario Centro Norte (commonly known as OMA), it handles national and international air traffic of the city of Chihuahua.
In 2019, 1,699,816 passengers used Chihuahua Airport, decreasing to 818,151 in 2020."
1191832,0,Chileka International Airport,"Chileka International Airport (IATA: BLZ, ICAO: FWCL) is an international airport in Malawi. It is located approximately 13 km (7 nmi; 8 mi), by road, northwest of Blantyre, the second largest city in the Republic of Malawi and the country's commercial and financial capital. Chileka is Malawi's second international airport, the other being Kamuzu International Airport, in Lilongwe, the nation's capital city."
52732555,0,Chinchero International Airport,"Chinchero International Airport is an under construction international airport in the town of Chinchero District, Cusco Region, Perú. It is planned to replace Alejandro Velasco Astete International Airport. Its altitude will be 3,720 metres (12,200 ft) above sea level."
38046876,0,Chinggis Khaan International Airport,"Chinggis Khaan International Airport (Mongolian: Чингис хаан олон улсын нисэх буудал), also referred to as New Ulaanbaatar International Airport (Mongolian: Улаанбаатар хотын олон улсын шинэ нисэх онгоцны буудал), (IATA: UBN, ICAO: ZMCK), is an international airport located in the Khöshig Valley of Sergelen, Töv, Mongolia, 52 km south of the capital Ulaanbaatar and 20 km southwest of Zuunmod. It started its operations on 4 July 2021 and serves as the primary airport for Ulaanbaatar and its metropolitan area, functioning as a replacement for Buyant-Ukhaa International Airport. Named after Genghis Khan, it is the largest air facility in the country, serving as a hub for all major Mongolian airlines.
The airport is designed with a capacity of handling up to 1,100 passengers per hour and two million passengers per year, with cargo capacity set at 11,900 tons.The airport is connected via highway to Ulaanbaatar, with four shuttle bus routes operating to and from various points in Ulaanbaatar as of 2021."
2685764,0,Chippewa County International Airport,"Chippewa County International Airport (IATA: CIU, ICAO: KCIU, FAA LID: CIU) is a public use airport in Chippewa County, Michigan, United States. It is located 15 nautical miles (17 mi, 28 km) south of the central business district of Sault Ste. Marie, Michigan. The airport is owned by the Chippewa County Economic Development Corporation. It was formerly the Kincheloe Air Force Base.
It is included in the Federal Aviation Administration (FAA) National Plan of Integrated Airport Systems for 2017–2021, in which it is categorized as a non-hub primary commercial service facility."
2125627,0,Chisinau International Airport,
8291283,0,Chita-Kadala International Airport,"Chita-Kadala International Airport (IATA: HTA, ICAO: UIAA) is a single runway airport, located in Chita (Russian: Чита, IPA: [tɕɪˈta]), the administrative center of Zabaykalsky Krai, Russia. The airport handles about 150,000 passengers per year."
30876906,0,Chitose International Airport,
23512246,0,Chittagong International Airport,
33315997,0,Chişinău International Airport,
700758,0,Chișinău International Airport,"Chișinău International Airport (IATA: KIV, ICAO: LUKK) is Moldova's main international airport, located 13 km (8.1 mi) southeast of the centre of Chișinău, the capital city. It serves as headquarters for Air Moldova, the country's national airline. The IATA airport code KIV is derived from Kishinev (the Russian and former English name of the city)."
7758902,0,Chlef International Airport,"Aéroport International de Chlef (IATA: CFK, ICAO: DAOI), also known as Aboubakr Belkaid Airport, is an airport 5 kilometres (3.1 mi) north of the city of Chlef, in Algeria.
The DAOI-Chlef VOR/DME (Ident: CLF) is located on the field.During World War II, the facility was known as ""Warnier Airfield"".  It was a major Twelfth Air Force base of operations during the North African Campaign against the German Afrika Korps."
8409098,0,Chongqing International Airport,
5318329,0,Chongqing Jiangbei International Airport,"Chongqing Jiangbei International Airport (IATA: CKG, ICAO: ZUCK) is located in Yubei District, Chongqing, People's Republic of China. The airport's IATA Airport code, CKG, is derived from the city's former romanized name, Chungking. Jiangbei airport is also a 128-hour transit visa-free airport for foreigners from many countries. It was awarded first place in the ""Best Airport in the 25–40 Million Passenger Size"" category by Airports Council International in 2017 and again in 2018.Situated 19 kilometres (12 mi) north of the city centre of Chongqing, the airport is a major aviation hub for airlines in western China, including China Express Airlines, China Southern Airlines (Chongqing Airlines), Sichuan Airlines, Shandong Airlines, XiamenAir and China West Air. Chongqing is a focus city of Air China and Hainan Airlines.
The airport has three terminals: Terminal 2 serving domestic flights and Terminal 3A other domestic flights and all international flights while Terminal 1 is currently closed. The first, second, and third phases of the airport came into operation in January 1990, December 2004, and December 2010, respectively. Terminal 2 is capable of handling 15 million passengers and Terminal 3A 45 million passengers annually.In terms of passenger traffic, Jiangbei Airport was the ninth-busiest airport nationwide in 2018, handling 41,595,887 passengers with a year-on-year growth of 7.4 percent. The airport was the eighth-busiest airport by traffic movements and tenth-busiest airport by cargo traffic in China in 2016.

"
62447823,0,Christchurch International Airport,
63352343,0,Chu Lai International Airport,
10081717,0,Chub Cay International Airport,"Chub Cay Airport is an airport in Chub Cay in the Berry Islands in The Bahamas (IATA: CCZ, ICAO: MYBC). The airport actually lies in Frazers Hog Cay."
1527493,0,Chubu Centrair International Airport,"Chubu Centrair International Airport (中部国際空港, Chūbu Kokusai Kūkō) (IATA: NGO, ICAO: RJGG) is an international airport on an artificial island in Ise Bay, Tokoname City in Aichi Prefecture, 35 km (22 mi) south of Nagoya in central Japan.Centrair is classified as a first class airport and is the main international gateway for the Chubu (""central"") region of Japan. The name ""Centrair"" (セントレア, Sentorea) is an abbreviation of Central Japan International Airport, an alternate translation used in the English name of the airport's operating company, Central Japan International Airport Co., Ltd. (中部国際空港株式会社, Chūbu Kokusai Kūkō Kabushiki-gaisha). 10.2 million people used the airport in 2015, ranking 8th busiest in the nation, and 208,000 tons of cargo was moved in 2015."
5348547,0,Chubu International Airport,
423222,0,Chung-cheng International Airport,
8198794,0,Chuuk International Airport,"Chuuk International Airport (IATA: TKK, ICAO: PTKK) is an airport located on Weno (formerly Moen), the main island of the State of Chuuk (formerly Truk) in the Federated States of Micronesia."
31095688,0,Chángshā Huánghuā International Airport,
51585916,0,Chūbu Centrair International Airport,
22879655,0,Chūbu International Airport,
49769167,0,Ciampino-G. B. Pastine International Airport,
49769077,0,Ciampino - G.B. Pastine International Airport,
39383671,0,Ciampino – G.B. Pastine International Airport,
701658,0,Ciampino–G. B. Pastine International Airport,"Rome—Ciampino International Airport ""G. B. Pastine"" (Italian: Aeroporto Internazionale di Roma–Ciampino ""G. B. Pastine"") (IATA: CIA, ICAO: LIRA), is the secondary international airport of Rome, the capital of Italy, after Rome-Fiumicino Airport ""Leonardo da Vinci"". It is a joint civilian, commercial and military airport situated 6.5 NM (12.0 km; 7.5 mi) south southeast of central Rome, just outside the Greater Ring Road (Italian: Grande Raccordo Anulare or GRA) the circular motorway around the city.
The airport is an important hub for many low-cost carriers and general aviation traffic. It also hosts a military airport and the headquarters of the 31º Stormo and the 2nd Reparto Genio of the Italian Air Force. The airport is named after Giovan Battista Pastine, an Italian airship pilot who served in World War I."
4165553,0,Cibao International Airport,"Cibao International Airport (Spanish: Aeropuerto Internacional del Cibao) (IATA: STI, ICAO: MDST), also known as Santiago Airport, is located in Santiago de los Caballeros, Dominican Republic's second-largest city. It is the country's third-busiest airport by passenger traffic and aircraft movements, after Punta Cana International Airport and Las Américas International Airport. Since its inauguration, Cibao International has been projected to become one of busiest airports in terms of passenger traffic in the country. Presently it has become the third-busiest airport in the Dominican Republic, only being surpassed by the airports of Punta Cana and Santo Domingo. The airport served more than 970,000 passengers in 2006.The airport is located 15 kilometers (9.3 mi) southeast of Santiago City's center.
The air terminal mainly serves Dominicans residing in the United States, the Turks and Caicos Islands, and Puerto Rico, as well as Haitians residing in the Cibao Region. Recently many tourists and missionary workers are using Cibao Int'l as a gateway to the Dominican Republic.
JetBlue is the primary international operator, with up to twenty daily flights to New York–JFK, Newark, and Boston. The airline replaced flights from American Airlines, and some slots from other airlines flying to the United States of America."
264292,0,Cincinnati-Northern Kentucky International Airport,
264379,0,Cincinnati/Northern Kentucky International Airport,"Cincinnati/Northern Kentucky International Airport (IATA: CVG, ICAO: KCVG, FAA LID: CVG) is a public international airport located in Hebron, Kentucky, United States. It serves the Cincinnati tri-state area. The airport's code, CVG, is derived  from the nearest city at the time of its opening, Covington, Kentucky. CVG covers an area of 7,700 acres (3,100 ha).Cincinnati/Northern Kentucky International Airport offers non-stop passenger service to over 50 destinations in North America and Europe. The airport is a global hub for Amazon Air, Atlas Air, ABX Air, Kalitta Air, and DHL Aviation, handling numerous domestic and international cargo flights every day. CVG is currently the 7th busiest airport in the United States by cargo traffic, and is additionally the fastest-growing cargo airport in North America."
264379,0,Cincinnati/Northern Kentucky International Airport,"Cincinnati/Northern Kentucky International Airport (IATA: CVG, ICAO: KCVG, FAA LID: CVG) is a public international airport located in Hebron, Kentucky, United States. It serves the Cincinnati tri-state area. The airport's code, CVG, is derived  from the nearest city at the time of its opening, Covington, Kentucky. CVG covers an area of 7,700 acres (3,100 ha).Cincinnati/Northern Kentucky International Airport offers non-stop passenger service to over 50 destinations in North America and Europe. The airport is a global hub for Amazon Air, Atlas Air, ABX Air, Kalitta Air, and DHL Aviation, handling numerous domestic and international cargo flights every day. CVG is currently the 7th busiest airport in the United States by cargo traffic, and is additionally the fastest-growing cargo airport in North America."
15505345,0,Cincinnati International Airport,
1099595,0,Cincinnati Northern Kentucky International Airport,
49338828,0,Cincinnati–Northern Kentucky International Airport,
23000724,0,Ciudad Acuna International Airport,
23000723,0,Ciudad Acuña International Airport,"Ciudad Acuña International Airport (Spanish: Aeropuerto Internacional de Ciudad Acuña, IATA: ACN, ICAO: MMCC) is an airport serving Ciudad Acuña, a city in the Coahuila state in México."
41822781,0,Ciudad Juarez International Airport,
2170133,0,Ciudad Juárez International Airport,"Abraham González International Airport (IATA: CJS, ICAO: MMCS) is an international airport located in Ciudad Juárez, Chihuahua, Mexico, near the Mexico–United States border opposite El Paso, Texas. It accommodates national and international air traffic of the city of Ciudad Juárez. It is named after Governor Abraham González of the State of Chihuahua.
In 2013, Volaris initiated over 25 weekly flights departing Ciudad Juárez.In 2019, Abraham González International Airport handled 1,597,471 passengers, and in 2020 it handled 790,009. One of the fastest growing airports in Mexico, traffic has doubled in the last five years."
8229549,0,Ciudad Obregon International Airport,
1847611,0,Ciudad Obregón International Airport,"Ciudad Obregón International Airport (IATA: CEN, ICAO: MMCN) is an international airport located 15 kilometers (9.3 miles) to the southeast of the center of Ciudad Obregón, Sonora, Mexico. It has one terminal with three gates and two jetways. There are two additional parking spaces for commercial aircraft. The airport is operated by Aeropuertos y Servicios Auxiliares, a federal government-owned corporation. The airport first came under management by Aeropuertos y Serviciois Auxiliares in 1965 after the corporation was first created to manage airport terminals in Mexico.
In 2019, the airport handled 373,337 passengers, and in 2020 it handled 215,145 passengers."
5463180,0,Ciudad Real International Airport,"Ciudad Real International Airport or CRIA (IATA: CQM, ICAO: LERL), previously known as Central Airport CR, Don Quijote Airport and South Madrid Airport, is an international airport and long-storage facility, situated south of Ciudad Real in Spain. Constructed at a cost of €1.1 billion, it was opened in 2009, and became the first international private airport in Spain.
Operations at the site ran for three years until April 2012, when its previous management company filed for bankruptcy and went into receivership, after the last flight operator, low-cost airline Vueling, withdrew its last route from the airport. It remained closed for seven years until finally reopening in September 2019, however without any scheduled passenger traffic.

"
2163506,0,Ciudad Victoria International Airport,"General Pedro José Méndez International Airport (Spanish: Aeropuerto Internacional General Pedro José Méndez, IATA: CVM, ICAO: MMCV), also known as Ciudad Victoria International Airport (Aeropuerto Internacional de Ciudad Victoria), is an international airport located in Ciudad Victoria, Tamaulipas, Mexico. It handles air traffic of the city of Ciudad Victoria. The airport is operated by Aeropuertos y Servicios Auxiliares, a federal government-owned corporation.

"
2163573,0,Ciudad del Carmen International Airport,"Ciudad del Carmen International Airport (IATA: CME, ICAO: MMCE) is an international airport located in Ciudad del Carmen, Campeche, Mexico. It handles national and international air traffic of the city of Ciudad del Carmen. It is operated by Aeropuertos y Servicios Auxiliares, a federal government-owned corporation.
The contraction in the oil and petrochemical activity in the area had a negative impact on the airport's operations. All scheduled international flights were canceled, and from a peak of 661,901 passengers in 2014, the airport handled 260,074 passengers in 2020."
23365765,0,Ciudad del carmen international airport,
2055880,0,Clark International Airport,"Clark International Airport (Kapampangan: Pangyatung Sulapawan ning Clark; Filipino: Paliparang Pandaigdig ng Clark; IATA: CRK, ICAO: RPLC) is an international airport covering portions of the cities of Angeles and Mabalacat within the Clark Freeport Zone in the province of Pampanga, Philippines. It is located 43.2 NM (80.0 km; 49.7 mi) northwest of Manila. It is accessible through the Subic–Clark–Tarlac Expressway (SCTEX).
The airport serves Central Luzon, Northern Luzon, and to an extent, Metro Manila. The name is derived from the former American Clark Air Base which was the largest overseas base of the United States Air Force until it was closed in 1991 and handed over to the Government of the Philippines.
The airport is managed and operated by Luzon International Premier Airport Development (LIPAD) Corp., a consortium of JG Summit Holdings, Filinvest Development Corporation, Philippine Airport Ground Support Solutions (PAGSS) Inc., and Changi Airports Philippines Pte. Ltd.; while the southern part of the facility is utilized by the Philippine Air Force as Clark Air Base.The airport serves both international and domestic flights. A new passenger terminal building has been constructed by Filipino engineering and infrastructure firm Megawide Construction Corporation and the construction of the new terminal was completed in September 2020. It is expected to be inaugurated and opened within 2021. The airport has been nominated for the Prix Versailles awards, which recognizes the best architecture and design projects in the world, competing with the Berlin Brandenburg Airport in Germany, Athens International Airport in Greece, and more airports.

"
3371273,0,Clayton J. Lloyd International Airport,"Clayton J. Lloyd International Airport (IATA: AXA, ICAO: TQPF) (formerly known as the Anguilla Wallblake Airport) is a small international airport located on the island of Anguilla, a British Overseas Territory in the Caribbean.  It is located very close to The Valley, the island's capital. Wallblake Airport is also a featured airport in one of the Flight Simulator X game demos. It has a small terminal with no jetways and is the only airport in Anguilla.
The airport became known as the ""Clayton J. Lloyd International Airport"" on 4 July 2010.  Its namesake was the first Anguillan aviator and founded the first Anguillan air service, Air Anguilla, which was later renamed Valley Air Service. The airport houses the Anguilla Outstation of the Eastern Caribbean Civil Aviation Authority.

"
29788467,0,Clayton Lloyd International Airport,
15437282,0,Clearwater International Airport,
669756,0,Cleveland-Hopkins International Airport,
669756,0,Cleveland-Hopkins International Airport,
