pageid,ns,title,extract
2224137,0,Cranbrook/Canadian Rockies International Airport,"Cranbrook/Canadian Rockies International Airport (IATA: YXC, ICAO: CYXC) is an international airport located 5 nautical miles (9.3 km; 5.8 mi) north of Cranbrook and 20 km (12 mi) south-east of Kimberley, British Columbia, in the Canadian Rockies.
It is owned by the City of Cranbrook and operated by Elevate Airports Inc. Runway 16/34 is an 8,000 by 150 ft (2,438 by 46 m) asphalt runway with a category 1 instrument landing system capable of guiding aircraft down to 200 ft (61 m) in 1⁄2 mi (0.80 km) of visibility. The terminal building covers 23,000 sq ft (2,100 m2). In 2008, YXC served over 106,277 passengers and in 2010 had 15,060 aircraft movements. The airport is operated 24 hours a day by the Cranbrook Flight Service Station.
It is classified as an airport of entry by Nav Canada and is staffed by the Canada Border Services Agency (CBSA). CBSA officers at this airport can handle general aviation aircraft only, with no more than 15 passengers. With prior notice, CBSA officers are able to handle commercial aircraft with up to 50 passengers, cost recovery is in effect for handling commercial aircraft."
5762092,0,Cristiano Ronaldo International Airport,"Cristiano Ronaldo International Airport, Madeira, commonly known as Madeira Airport (Portuguese: Aeroporto da Madeira), Funchal Airport (Aeroporto do Funchal), or Santa Catarina Airport (Aeroporto de Santa Catarina) (IATA: FNC, ICAO: LPMA), is an international airport in the civil parish of Santa Cruz in the Portuguese archipelago and autonomous region of Madeira. The airport is located 13.2 km (8.2 mi) east-northeast of the regional capital, Funchal, after which it is sometimes informally named. It mostly hosts flights to European metropolitan destinations due to Madeira's importance as a leisure destination, and is pivotal in the movement of cargo in and out of the archipelago of Madeira. It is the fourth-busiest airport in Portugal. The airport is named after Madeiran native Cristiano Ronaldo, who is widely considered to be one of the greatest footballers of all time. During its renaming ceremony in 2017, the airport gained fame for an infamous bust of Ronaldo unveiled at the ceremony.The airport is considered one of the most peculiarly perilous airports in the world due to its location and its spectacular runway construction. It received the Outstanding Structure Award in 2004 by the International Association for Bridge and Structural Engineering. The History Channel program Most Extreme Airports ranked it as the ninth most dangerous airport in the world and the third most dangerous in Europe. Pilots must undergo additional training to land at the airport."
4487465,0,Crnl. FAP. Carlos Ciriani Santa Rosa International Airport,
38934979,0,Crnl. FAP Carlos Ciriani Santa Rosa International Airport,
39051377,0,Crnl. FAP Francisco Secada Vignetta International Airport,
43662477,0,Cross-border Terminal at Tijuana International Airport,
3473959,0,Crown Point International Airport,
16747380,0,Cruzeiro do Sul International Airport,"Cruzeiro do Sul International Airport (IATA: CZS, ICAO: SBCZ) is the airport serving Cruzeiro do Sul, Brazil. It is the westernmost Brazilian airport served by scheduled flights.
It is operated by Infraero and Vinci SA."
22871069,0,Cuam International Airport,
43063292,0,Cuenca International Airport,
3090993,0,Cuernavaca International Airport,
31556335,0,Cuiaba International Airport,
31556328,0,Cuiabá International Airport,
39846824,0,Culiacán International Airport,"Bachigualato Federal International Airport (Spanish: Aeropuerto Internacional Federal de Bachigualato, IATA: CUL, ICAO: MMCL), commonly named Culiacán International Airport (Aeropuerto Internacional de Culiacán), is an international airport located at Culiacán, Sinaloa, Mexico. It handles the national and international air traffic of the city of Culiacán.
The airport is among the Top 10 busiest airports in Mexico, and the busiest in domestic traffic and second busiest for international operations in the state of Sinaloa. It is currently handled by Grupo Aeroportuario Centro Norte, having undergone major construction consisting of a new terminal layout and a new boarding system. It has two jetways.
In 2019, Culiacán airport moved 2,458,863 passengers, and 1,373,102 in 2020.Bachigualato Federal International Airport is named after the neighborhood of Bachigualato, where the airport is located.
In favorable weather, flights from the Baja California peninsula and north arrive to runway 02, and flights from the rest of the country to runway 20.
The state executive announced plans to expand the airport and the construction of a second runway to support Boeing 777 landings."
7677806,0,Cuneo International Airport,"Cuneo International Airport (Italian: Aeroporto di Cuneo-Levaldigi) (IATA: CUF, ICAO: LIMZ) also named Cuneo Levaldigi Airport or Turin Cuneo Airport by some low-cost airlines, is an airport serving Cuneo and Turin, Piedmont, Italy. It is the second airport of Piedmont, after Turin Airport."
39499925,0,Curacao International Airport,
2453515,0,Curaçao International Airport,"Curaçao International Airport (IATA: CUR, ICAO: TNCC), (Dutch: Hato Internationale luchthaven) also known as Hato International Airport (formerly Dr. Albert Plesman International Airport), is the only airport for the island of Curaçao. The airport is located on the north coast of Curaçao, 12 kilometres (7.5 mi) from the capital Willemstad. Curaçao International Airport services flights from the Caribbean region, South America, North America and Europe and has the third longest commercial runway in the Caribbean region after Rafael Hernández Airport in Puerto Rico and Pointe-à-Pitre International Airport in Guadeloupe. The airport serves as a main base for Divi Divi Air, Jetair Caribbean as well as EZAir; it formerly served as a main base for ALM, KLM, DCA, DAE and Insel Air.
Located on the Dutch Caribbean island of Curaçao, connects Europe, the Americas and the Caribbean. Curaçao International Airport is served by several airlines. The Curaçao International Airport has one of the longest runways in the Caribbean, accommodating up to a Boeing 747. In the early fall of 2014, Curaçao International Airport opened a new General Aviation Center offering premier service in a separate building with a private entrance and exit and special amenities."
23058345,0,Curitiba / Afonso Pena International Airport,
28665843,0,Cuscatlan International Airport,
2558650,0,Cuscatlán International Airport,
3969507,0,Cusco International Airport,
25223626,0,Cyril E. King International Airport,
17311517,0,Cát Bi International Airport,
18750751,0,Côte d'Azur International Airport,
369226,0,Côte d' Azur International Airport,
22930145,0,Cần Thơ International Airport,
25144396,0,DFW International Airport,
2920410,0,Da Nang International Airport,"Da Nang International Airport (IATA: DAD, ICAO: VVDN) is located in Da Nang, the largest city in central Vietnam.  It is the third international airport in the country, besides Noi Bai International Airport (Hanoi) and Tan Son Nhat International Airport (Ho Chi Minh City), and is an important gateway to access central Vietnam.
In addition to its civil aviation, the runway is shared with the Vietnamese People's Air Force (VPAF, the Không Quân Nhân Dân Việt Nam), although military activities are now extremely limited.
The airport served 5 million passengers in 2014, reaching that passenger count around six years sooner than expected. An expansion of the new terminal is currently considered to increase its capacity to 10 million passengers per annum by 2020.
This airport handled 6,722,587 passengers in 2015, an increase of 34.7% compared with that of 2014.This airport handled 11 million passengers in 2017, an increase of 24.1% compared to that of 2016. The airport has two separate terminals for international and domestic passengers with total passenger capacity of 11 million per annum as at 2018. The Hanoi-Danang and Ho Chi Minh City-Danang routes have respectively 319 and 250 weekly flights and are, in order, the second and third busiest air routes in Vietnam after the Hanoi-Ho Chi Minh route (475 flights)."
1519916,0,Daegu International Airport,"Daegu International Airport (Hangul: 대구국제공항; Hanja: 大邱國際空港; Revised Romanization: Daegu Gukje Gonghang; McCune-Reischauer: Taegu Kukche Konghang) (IATA: TAE, ICAO: RKTN) is the international airport serving the city of Daegu and the surrounding area in the southeast of South Korea. The airport is also a military base for the ROKAF's 11th Fighter Wing, whose three squadrons fly the F-15K."
814760,0,Dakar-Yoff-Leopold Sedal Senghor International Airport,
8229568,0,Dakar-Yoff-Leopold Sedar Senghor International Airport,
23977337,0,Dakar-Yoff-Léopold Sédar Senghor International Airport,
22287308,0,Dakar-Yoff / Léopold Sédar Senghor International Airport,
62939562,0,Dakar-Yoff International Airport,
11111905,0,Dakar International Airport,"Dakar International Airport may refer to:

Blaise Diagne International Airport, a passenger airport opened in 2017 near Diass, Senegal
Léopold Sédar Senghor International Airport, a cargo and military airport near Yoff, Senegal"
46304597,0,Dakar Yoff International Airport,
7536482,0,Dalian International Airport,
49203434,0,Dalian Jinzhouwan International Airport,"Dalian Jinzhouwan International Airport is an airport being built to serve the city of Dalian in Liaoning Province, northeast China. Once open it will replace the existing Dalian Zhoushuizi International Airport as the city's main airport. It is being built on 21 square kilometres (8.1 sq mi) of reclaimed land off the coast of Dalian. Expected to open in 2024, it is set to become the world's largest offshore airport."
1648191,0,Dalian Zhoushuizi International Airport,"Dalian Zhoushuizi International Airport (IATA: DLC, ICAO: ZYTL) is the airport serving the city of Dalian in Liaoning Province, China. It is located in Ganjingzi District, about 10 km (6 mi) northwest of the city center. In 2018 the airport handled 18,758,171 passengers, making it the busiest airport in Northeast China and the 24th busiest nationwide. The airport is the hub for Dalian Airlines and a focus city for China Southern Airlines and Hainan Airlines. As Zhoushuizi Airport has reached its designed capacity, the new Dalian Jinzhouwan International Airport is being built on reclaimed land to replace it."
37415782,0,Dallas-Fort Worth International Airport,
263583,0,Dallas-Ft. Worth International Airport,
248480,0,Dallas/Fort Worth International Airport,"Dallas/Fort Worth International Airport (IATA: DFW, ICAO: KDFW, FAA LID: DFW), also known as DFW Airport, is the primary international airport serving the Dallas–Fort Worth metroplex area in the U.S. state of Texas. The airport was the fourth-busiest airport by passenger traffic in the world and second-busiest in the United States.
It is the largest hub for American Airlines, which is headquartered near the airport. It is the third-busiest airport in the world by aircraft movements and the fourth-busiest airport in the world by passenger traffic in 2020. It is the ninth-busiest international gateway in the United States and the second-busiest international gateway in Texas. American Airlines at DFW is the second-largest single airline hub in the world and the United States, behind Delta's hub at Atlanta. The airport was also a hub for Delta Air Lines until 2005.
Located roughly halfway between the major cities of Dallas and Fort Worth, DFW spills across portions of Dallas and Tarrant counties, and includes portions of the cities of Irving, Euless, Grapevine and Coppell. At 17,207 acres (6,963 hectares; 27 square miles), DFW is larger than the island of Manhattan, and is the second-largest airport by land area in the United States, after Denver International Airport. It has its own post office ZIP Code, 75261, and United States Postal Service city designation (""DFW Airport, TX""), as well as its own police, fire protection, and emergency medical services.As of November 2021, DFW Airport has service to 260 destinations from 26 scheduled airlines. In surpassing 200 destinations, DFW joined a small group of airports worldwide with that distinction.

"
3130475,0,Dallas Fort Worth International Airport,
48475586,0,Dallas International Airport,
24162754,0,Dallas–Fort Worth International Airport,
4202280,0,Damascus International Airport,"Damascus International Airport (Arabic: مَطَار دِمَشْق الدَّوْلِيّ, romanized: Maṭār Dimašq ad-Dawaliyy) (IATA: DAM, ICAO: OSDI) is the international airport of Damascus, the capital of Syria. Inaugurated in the mid-1970s, it also was the country's busiest airport. In 2010, an estimated 5.5 million passengers used the airport, an increase of more than 50% since 2004."
30777460,0,Damascus International airport,
30777483,0,Damascus international airport,
19203241,0,Dan Jones International Airport,"Dan Jones International Airport (FAA LID: T51) is a public-use airport in unincorporated Harris County, Texas, United States that is privately owned by Daniel Jones of Cypress. The airport is located 5 nautical miles (9 km) southwest of the city of Tomball and 22 nautical miles (41 km) northwest Houston."
4701767,0,Danang International Airport,
53936353,0,Daniel Inouye International Airport,
264285,0,Daniel K. Inouye International Airport,"Daniel K. Inouye International Airport (IATA: HNL, ICAO: PHNL, FAA LID: HNL), also known as Honolulu International Airport, is the main airport of Oahu in the State of Hawaii. The airport is named after U.S. Senator and Medal of Honor recipient Daniel K. Inouye, who represented Hawaii from 1963 until his death in 2012. The airport is located in the Honolulu census-designated place three miles (5 km) northwest of Honolulu's central business district. The airport covers a total area of 4,220 acres (1,708 ha) of land, more than 1% of Oahu's land area.Daniel K. Inouye International Airport offers nonstop flights to numerous destinations in North America, Asia, and Oceania. The airport serves as the principal hub of Hawaiian Airlines and is also a base for Aloha Air Cargo. The airport is included in the Federal Aviation Administration (FAA) National Plan of Integrated Airport Systems for 2017–2021, in which it is categorized as a large-hub primary commercial service facility.

"
60818386,0,Daniel K. Inoyue International Airport,
6438685,0,Daniel Oduber International Airport,
3412520,0,Daniel Oduber Quiros International Airport,
69002161,0,Daniel Oduber Quirós International Airport,
10287958,0,Daqiu International Airport,
21932341,0,Dar es Salaam International Airport,
1889695,0,Darwin International Airport,"Darwin International Airport (IATA: DRW, ICAO: YPDN) is the busiest airport serving the Northern Territory and the tenth busiest airport in Australia.  It is the only airport serving Darwin.
The airport is located in Darwin's northern suburbs, 8 km (5.0 mi) from Darwin city centre, in the suburb of Eaton. It shares runways with the Royal Australian Air Force's RAAF Base Darwin.
Darwin Airport has an international terminal, a domestic terminal and a cargo terminal. Both of the passenger terminals have a number of shops and cafeterias.
In 2011 the airport served 26,036 flights and 1,743,734 passengers."
12911334,0,Daugavpils International Airport,"The Daugavpils International Airport (Latvian: Daugavpils Starptautiskā Lidosta) is located 12 km northeast of Daugavpils in the village of Lociki, Naujene Parish, Augšdaugava Municipality, in the Latgale region of Latvia.
All of the airport's technical infrastructure, runway and buildings are what was left of the former Soviet military air base. The base was completely abandoned in 1993.  Since 2005 the city council has sought to promote plans to redevelop it, however these have not been able to obtain funding."
66374432,0,Davao International Airport,
27381649,0,David Ben Gurion International Airport,
9301034,0,David the Builder Kutaisi International Airport,"Kutaisi International Airport (IATA: KUT, ICAO: UGKO) also known as David the Builder Kutaisi International Airport is an airport located 14 km (8.7 mi) west of Kutaisi, the third largest city in Georgia and capital of the western region of Imereti. It is one of three international airports currently in operation in Georgia, along with Tbilisi International Airport serving the Georgian capital and Batumi International Airport near the Adjara Black Sea resort. The airport is operated by United Airports of Georgia, a state-owned company."
61880269,0,Daxing International Airport,
725509,0,Dayton International Airport,"Dayton International Airport (IATA: DAY, ICAO: KDAY, FAA LID: DAY) (officially James M. Cox Dayton International Airport), formerly Dayton Municipal Airport and James M. Cox-Dayton Municipal Airport, is 10 miles north of downtown Dayton, in Montgomery County, Ohio, United States. The airport is in an exclave of the city of Dayton not contiguous with the rest of the city. Its address is 3600 Terminal Drive, Dayton, Ohio 45377. The airport is headquarters for American Eagle carrier PSA Airlines.
The National Plan of Integrated Airport Systems called it a primary commercial service airport. Dayton International is the third busiest and third largest airport in Ohio behind Cleveland Hopkins International Airport and John Glenn Columbus International Airport.

Dayton International Airport handled 2,607,528 passengers in 2012 and had 57,914 combined takeoffs and landings in 2012. Dayton ranked No. 76 in U.S. airport boardings in 2008. The airport has non-stop flights to 17 destinations."
2509585,0,Daytona Beach International Airport,"Daytona Beach International Airport (IATA: DAB, ICAO: KDAB, FAA LID: DAB) is a county-owned airport located three miles (5 km) southwest of Daytona Beach, next to Daytona International Speedway, in Volusia County, Florida, United States. The airport has 3 runways, a six-gate domestic terminal, and an international terminal. Daytona Beach is the headquarters of Embry-Riddle Aeronautical University.

"
40356925,0,De Guanajuato International Airport,
2119664,0,Debrecen International Airport,"Debrecen International Airport (IATA: DEB, ICAO: LHDC) is the international airport of Debrecen in the Hajdú-Bihar County of Hungary. It is located 5 km (3.1 mi) south southwest of the city center and also easily accessible to adjacent regions of Romania and Ukraine."
62253412,0,Deer Lake International Airport,
18812966,0,Dehi - Indira Gandhi International Airport,
8229586,0,Del Bajio International Airport,
63566707,0,Del Bajío International Airport,
42057652,0,Del Bonita/Whetstone International Airport,
29773430,0,"Del Caribe ""Santiago Marino"" International Airport",
47733175,0,"Del Caribe ""Santiago Mariño"" International Airport",
8598930,0,Del Caribe International Airport,
2190740,0,Del Norte International Airport,"Del Norte International Airport (Spanish: Aeropuerto Internacional del Norte, IATA: NTR, ICAO: MMAN) is an airport located in General Escobedo, Nuevo León, working as a secondary airport for Mexico's second largest city, Monterrey."
2696240,0,Del Rio International Airport,"Del Rio International Airport (IATA: DRT, ICAO: KDRT, FAA LID: DRT) is two miles northwest of Del Rio, in Val Verde County, Texas, United States. It is used for general aviation, and, being near Laughlin Air Force Base, it is often used by USAF students.

"
49771697,0,Delhi - Indira Gandhi International Airport,
17363972,0,Delhi International Airport,
38157015,0,Delhi – Indira Gandhi International Airport,
6759404,0,Denpasar-Bali International Airport,
15782280,0,Denpasar International Airport,
16537820,0,Denver's new international airport,
263648,0,Denver International Airport,"Denver International Airport (IATA: DEN, ICAO: KDEN, FAA LID: DEN), locally known as DIA, is an international airport in the Western United States, primarily serving metropolitan Denver, Colorado, as well as the greater Front Range Urban Corridor. At 33,531 acres (52.4 sq mi; 135.7 km2), it is the largest airport in North America by land area and the second largest in the world, behind King Fahd International Airport. Runway 16R/34L, with a length of 16,000 feet (3.03 mi; 4.88 km), is the longest public use runway in North America and the seventh longest in the world. The airport is 25 miles (40 km) driving distance from Downtown Denver, 19 miles (31 km) further than the former Stapleton International Airport, the facility DIA replaced: the airport is actually closer to the City of Aurora than central Denver, and many airport services, such as hotels, use either an Aurora or Denver mailing address. Opened in 1995, DEN currently has non-stop service to 215 destinations amongst 23 different airlines throughout North America, Latin America, Europe, and Asia; it is the fourth airport in the U.S. to exceed 200 destinations. The airport is a hub for both United Airlines and Frontier Airlines and is one of the largest operating bases for Southwest Airlines. With over 35,000 employees, the airport is the largest employer in Colorado. The airport is located on the western edge of the Great Plains and within sight of the Front Range of the Rocky Mountains.
In 2020, DIA was the 8th busiest airport in the world and 3rd busiest airport in the United States by passenger traffic; DIA has been among the top 20 busiest airports in the world every year since 2000."
263648,0,Denver International Airport,"Denver International Airport (IATA: DEN, ICAO: KDEN, FAA LID: DEN), locally known as DIA, is an international airport in the Western United States, primarily serving metropolitan Denver, Colorado, as well as the greater Front Range Urban Corridor. At 33,531 acres (52.4 sq mi; 135.7 km2), it is the largest airport in North America by land area and the second largest in the world, behind King Fahd International Airport. Runway 16R/34L, with a length of 16,000 feet (3.03 mi; 4.88 km), is the longest public use runway in North America and the seventh longest in the world. The airport is 25 miles (40 km) driving distance from Downtown Denver, 19 miles (31 km) further than the former Stapleton International Airport, the facility DIA replaced: the airport is actually closer to the City of Aurora than central Denver, and many airport services, such as hotels, use either an Aurora or Denver mailing address. Opened in 1995, DEN currently has non-stop service to 215 destinations amongst 23 different airlines throughout North America, Latin America, Europe, and Asia; it is the fourth airport in the U.S. to exceed 200 destinations. The airport is a hub for both United Airlines and Frontier Airlines and is one of the largest operating bases for Southwest Airlines. With over 35,000 employees, the airport is the largest employer in Colorado. The airport is located on the western edge of the Great Plains and within sight of the Front Range of the Rocky Mountains.
In 2020, DIA was the 8th busiest airport in the world and 3rd busiest airport in the United States by passenger traffic; DIA has been among the top 20 busiest airports in the world every year since 2000."
27960263,0,Denver international airport,
6391204,0,Denver’s new international airport,
7596319,0,Deputado Luis Eduardo Magalhaes International Airport,
64033316,0,Deputado Luís Eduardo Magalhães International Airport,
68726755,0,Dera Ghazi Khan International Airport,
1371941,0,Des Moines International Airport,"Des Moines International Airport (IATA: DSM, ICAO: KDSM, FAA LID: DSM) is a commercial service airport 5 miles (8 km) southwest of Des Moines, the capital of Iowa. 
The airport's 2,600 acre campus includes two runways, 46 buildings, 7 parking facilities, and the terminal. Six commercial airlines offer service from DSM (American, Allegiant, Delta, Frontier, Southwest and United). The airport is managed by the Des Moines Airport Authority.
The National Plan of Integrated Airport Systems for 2017–2021 called it a primary commercial service airport. In 2016 a record 2.48 million passengers used the airport, up 5 percent from 2015. In 2019, DSM served 2.92 million passengers, a record for the airport.
The airport hosts the 132nd Wing of the Iowa Air National Guard.

"
1371941,0,Des Moines International Airport,"Des Moines International Airport (IATA: DSM, ICAO: KDSM, FAA LID: DSM) is a commercial service airport 5 miles (8 km) southwest of Des Moines, the capital of Iowa. 
The airport's 2,600 acre campus includes two runways, 46 buildings, 7 parking facilities, and the terminal. Six commercial airlines offer service from DSM (American, Allegiant, Delta, Frontier, Southwest and United). The airport is managed by the Des Moines Airport Authority.
The National Plan of Integrated Airport Systems for 2017–2021 called it a primary commercial service airport. In 2016 a record 2.48 million passengers used the airport, up 5 percent from 2015. In 2019, DSM served 2.92 million passengers, a record for the airport.
The airport hosts the 132nd Wing of the Iowa Air National Guard.

"
1570161,0,Detroit International Airport,
669768,0,Detroit Metro-Wayne International Airport,
52631923,0,Detroit Wayne International Airport,
3872040,0,Deubai international airport,
63053357,0,Devi Ahilya Bai Holkar International Airport,
49320791,0,Devi Ahilyabai Holkar International Airport,
43248767,0,Dhahran International Airport,
23512196,0,Dhaka International Airport,
60171794,0,Dholera International Airport,
3870674,0,Diagoras International Airport,
